text,label
こんにちはー。,1
本日は、ご利用ありがとうございます。,0
はい。,1
えーと、ご旅行の方ですけれども、どういったものをご希望ですか？,0
えー、海で泳ぎたい、です。,1
海水浴でございますか？,0
はい。,1
どこか、あのどこでやり、こう海水浴、う、したいとかって、ありますかね？,0
あのー、こう、どの辺の海がいいとか。,0
どういう海がありますか？,1
少々お待ちくださーい。,0
一応、結構、日本全国あるんですが。,0
北海道からー、えー一応東北もありますし、えーそうですね、秋田とかもございますし、もう本当に日本て海に囲まれているので、もう至る所に海水浴場があるんですけれども。,0
はい。,1
そ、どうですかね？,0
これ、寒い方に行って海に入るか、温かい方に行って海に入るかっていう感じなんですけれどもー、もしくは日本海の方に行くとか、あの色々あると思うんですけれども。,0
あの、どっちの方に行きたいですかね？,0
こう、例えばー、あの寒い方に行けば、あのーまあ日本海の方の海っていうのもありますし、暑い方ですと、あ沖縄の珊瑚礁とかもございますし。,0
色々あるんですけれどもー、何か―、見てみたいとかありますかね？,0
やってみたいとか、食べたいものとか。,0
あー、食べたいもの。,1
海水浴に行って―、ついでに何か食べるっていうんだったら、何かこう場所が定まってくると思うんですけれども。,0
魚、で。,1
魚を食べて海水浴をする、みたいな感じですか？,0
はい。,1
そうしますと、まあ海の近くなんで、魚はいくらでもあるとは思うんですが。,0
はい。,1
特に―、ま魚の仲間でも何か蟹とか、もしくはお刺身とか、あると思うんですが、いかがでしょうか？,0
あー、お刺身が、食べたいです。,1
少々お待ちくださーい。,0
やなか、えーと、北の方の海水浴場とかがいいと思うんですけどー、どうですかね？,0
あのー、ま近くでもあるんですが、遠くもありますが、こんな遠くは行きたくないよ、とかっていうのありますか？,0
や、特にないです。,1
では北海道とか、行ってみますか？,0
はい。,1
で、季節とかは一応じゃあ、夏的な感じですか？,0
はい。,1
えっとー、一応何名様ぐらいで考えてますか？,0
5、6人、です。,1
じゃちょっとー、今確認しますね。,0
えーっとですねー、今ー見ているんですけれども、えー海水浴場で、えー結構、北海道なんですけれども、え珍しい感じなんですが。,0
噴火湾に面し、地理的にも晴天が多く、か、ん、えー海浜は遠浅になっておりまして、えー波が穏やか、子供も安心して水遊びが出来る、えーファミリーに最適な海水浴場となっております。,0
こちらは、いかがですか？,0
えーと、こちらが有珠海水浴場となっておりましてー、北海道にあります。,0
どうですかね？,0
あ、じゃあ、それで。,1
はい。,0
じゃあえーと、有珠海水浴場に行くっていう事で一応今、チェック入れときますねー。,0
えーとこちらで、えー何かお食事もするという感じで、まず海水浴をされてー、えーお食事って感じですけど、ちょっとお刺身の前に、この海水浴場の営業時間だけ申し上げておきますね。,0
はい。,1
えっと、朝の9時からー17時ですね。,0
えーまでがあのー、監視員の方がいてー、救護所がちゃんと開いております。,0
でー閉店日っていうか、あのお休みの時はありまして、えっと遊泳期間が7月下旬から8月中旬までなので、あのその期間中だけは、あのお休みなしなんですね。,0
あのー、例えば8月の末とかになってしまいますと、あのーもう閉まってしまいますので、ご注意下さい。,0
あと6月中とかにも、泳げません。,0
よろしくお願いし。,0
えーっと、散策とかは自由で、お金のかからない海水浴場になっておりますので、えー楽しんで来て下さい。,0
はい。,1
はい。,0
では、えーこの辺りでお食事ー、お刺身が食べられそうな所探しますね。,0
はい。,1
はい。,0
お刺身とか、好きですか？,0
はい。,1
あーちょっと今、海鮮…和食で、ちょっとこないですねー。,0
えっとー、普通のお刺身とかがいいですよね？,0
はい。,1
はい。,0
じゃあ一応ですね、今見ているとー、えー一応場所が札幌なんですけれども。,0
えー港直送の、新鮮魚介がリーズナブルに味わえると評判というお店があるんですけれども、こちらはいかがでしょうか？,0
あの、北海道、は、はい。,0
いいですか？北海道料理浜っ子っていうお店です。,0
とい、あ、すいませんちょっとこちら営業時間が16時から13時、あ16時から30分、えー翌朝になるんで、これちょっと夜になっちゃうんですね。,0
すいません、お昼ご飯なんで、ちょっともう一回確認させて下さい。,0
はい。,1
あっ、こちらでしたらちょ、お刺身居酒屋えー瑠玖本店てとこなんですけれども、海鮮丼でしたりとかお刺身の盛り合わせがあるお店なんですが、こちら同じ札幌にございまして、えとこちらでしたら、あのお昼もメニューございますので、いかがでしょうか？,0
あ、じゃあ。,1
はい。,0
えーと一応11時30分から23時の営業で、えーと閉店日はございませんので、えーこちらチェックさせていただきますね。,0
はい。,1
その他何かー、この辺りで、えー食べたいとかー、ありますか？,0
あー。,1
せっかくー、札幌にいるので、えーお菓子とかケーキとか何か、あとび何か見たりとか、ございますかね？,0
甘いものでも、食べますか？,0
はい。,1
はい。,0
一応色々出てきてるんですけれどもー、あのコーヒーとケーキとか、そ、そういったものとかどうですか？,0
北海道ならではみたいな、色々あるんですが。,0
あとパフェみたいなものも、ございますけれど。,0
アイスクリームとかも、北海道なので、何か美味しそうなんですけれど、どうでしょうね？,0
あ、アイスクリームが。,1
はい。,0
っと、雪印パーラー本店ていうのがあってー、こちらーちょっと今、細かい所見てみますね。,0
はい。,1
えほ、北海道産の新鮮でコクのある牛乳を使ったアイスクリームやデザートが楽しめる、ってなっております。,0
こちらー、何かすごく美味しそうなんですけれども、いかがでしょう？,0
何か、いいですか？,0
こちらで？,0
何か生キャラメルのバナナパフェとかもございますので、是非楽しんでください。,0
えっとー一応営業時間がじゅうい、10時から21時となっておりまして、えーと、らすたおラストオーダーが20時30分までなので、お気を付け下さい。,0
一応、よ、お店のお休みというのは無いので、えー安心して行かれるとだいじょ、思いますので、お願いします。,0
雪印パーラー本店を、えチェックさせていただきます。,0
はい。,1
えーっとー、ここでちょっとお腹もいっぱいで甘いものも食べてるんですが、何かこの辺りで観光とかしますか？,0
あー。,1
何か見たいものとか、分からなければ、ちょっと探してみますけれども。,0
札幌ならではの観光とか、してみませんか？,0
ぜ、絶景スポットとかは？,1
絶景スポットでございますか？,0
少々お待ち下さいね。,0
んー。,0
そうですねえ。,0
えー、んー、公園とか、いかがですかね？,0
何か色々、大通公園とかー、あるんですけれど。,0
あとは、旭山記念公園とかー、円山公園。,0
あとは、札幌市円山動物園ていうのがあるんですが、いかがですか？,0
レッサーパンダとかが、いますけれど。,0
あとシロクマとか。,0
あ、じゃあ、それで。,1
はい。,0
じゃこちらはー、札幌市、札幌中心部の、えー西約3キロに位置する円山公園内にある動物園です。,0
えー、ここは結構ドキドキ体験とかが出来るみたいなので、何かエサやりとかを何か、見る事が出来るみたいです。,0
ホッキョクグマ館もオープンしてますので、是非行って来て下さい。,0
一応営業時間が9時半から、えー16時半でして、えー1月から2月は16時までですけど、まあ夏ーにご予定なので、えー問題無いと思われます。,0
入園は800円で、高校生400円、中学生以下の方は無料で、えー見る事が出来ます。,0
よろしいでしょうか？,0
はい。,1
はい。,0
はい。,1
えー動物園を見て―、あと何か、見たいものとか、ありますかね？,0
ま、動物以外なものとか、あるかな、って思うんですけど。,0
良く分からないですかね？この辺。,0
大通公園とかも素敵ですし、あとー北海道大学の植物園と博物館とかもあるんですが、ご興味ありませんか？,0
あー。,1
何か一応写真では、オオカミみたいなものが写ってるんですけど、剥製ですけど、昔いた動物とかの博物館、これエゾオオカミですね。,0
何かこう絶滅してしまった動物とかを、あのー展示していますね。,0
ヒグマとか、あと南極観測で活躍した樺太犬タロの剥製も、って書いてありますね。,0
いかがでしょうか？,0
じゃ、それで、はい。,1
はい。,0
じゃああの北海道大学の、えー植物園博物館ていう所に、えー一応行くという事でチェック入れますが、一応ですねー、えーと四月か、にぶ29日から11月3日の間は、9時から16時の営業時間です。,0
よろしくお願いします。,0
で、月曜日がお休みで、月曜日が祝日の場合は翌の日、平日が、あのお休みです。,0
よろしくお願いします。,0
えーと。,0
何か料金の事ちょっと、細かい事が書いてないんですが、あの多分そんなにお金はかからないと思いますので、よろしくお願いします。,0
はい。,1
はい。,0
あとお土産とか、いかがしますかね？,0
あー、じゃあ。,1
はい。,0
と、一応色々あるんですけれども、何か民芸品とか、見てみたいものとか、ございますか？,0
はい。,1
えっとー、何がいいですかね？,0
食べるものとかー、こう、一応民芸品とかもあるんですが、んーどう、どんなものがいいですかね？,0
北海道の名産品とか、いかがですか？,0
じゃあ。,1
一応ですねー、えーと陶器とかー、雑貨とか売ってるお店とか、もしくは、あのーまあ何ですか、ズワイガニと毛ガニとか、蟹ですね。,0
蟹とかを買ってー、あのー何か、まあ送ってもらうとか食べるとか、いかがですか？,0
はい。,1
こちらは北の、えーリョウバ3号店というとこなんですが、えっとー一応ですね、ほ札幌にございまして、えー北海道の台所と呼ばれる札幌市中央卸市場のしじょうがい、あ、場外市場にある魚店でございます。,0
よろしいですかね？,0
はい。,1
はい。,0
何かお刺身とか、あのーお寿司とかも何か食べられそうなので、もしお腹すいたら食べる事も出来ますんで、えー、いいかなと思います。,0
一応営業時間が朝の6時半から、えー17時となっておりますので、お気を付け下さい。,0
えー、料金とかはかかりませんので、お願いします。,0
こちら、コピーさせてもらいますね。,0
あとはー、りょう、えー夕飯とかは、いかがしましょうか？,0
もしくは、もうちょっと。,0
あ、夕飯ちょっと考えますか？,0
はい。,1
何か食べたいものとか、ございますか？,0
はい。,1
何が食べたいですか？,0
お肉系です。,1
はい。,0
ちょっとー、見てみますね。,0
っとー、一応結構肉今出てきてるんですけど、ステーキとかはいかがですか？,0
あ、じゃあ、それで。,1
はい。,0
えっとー、肉の割烹田村大通BISSE店、ていう所なんですけれどもー。,0
はい。,1
一応写真では、すごいステーキとかしゃぶしゃぶとか、あのいっぱいお肉出てきてるんですが、すごい美味しそうです。,0
と、北海道美幌町で昭和2年に創業した田村精肉店の直営店です。,0
えーオホーツクの大地の食材を中心に、北海道各地のゆう、えー良質な、す素材を集めて料理を提供、と書かれています。,0
あのー一応お肉だけじゃなくて、海鮮とかもありまして、あとは地元で取れる野菜なども提供されるようでございます。,0
はい。,1
えー、こちらー一応、じゃあチェックさせていただくんですが、えっと夜の時間ですね。,0
お、開いてる時間が17時から22時となっておりまして、ラストオーダーは21時30分となっております。,0
一応店の休みの日はございませんので、えー、こちら行ってみて下さい。,0
はい。,1
肉の割烹田村大通BISSE店でございます。,0
じゃあ、何かあのちょっとお時間あるので、ご案内出来るんですけれども、お食事の後何か見て周るとか、ありますかね？ご希望。,0
夜景とか見ませんか？,0
はい。,1
ちょっと、今探しますね。,0
はい。,1
一応ですねー、えーロープウェイとかに乗ってー、あのーこう、展望台みたいな山の上の方に行って、あのー夜景を見るっていうのがあるんですけども、ロープウェイに乗って札幌の街を上から見てみるとか、いかがですか？,0
あ、じゃあ。,1
はい。,0
一応ですね、えー、札幌藻岩山ロープウェイ、というものでございます。,0
はい。,1
っと、も、藻岩山はアイヌの人々から、いつもそこに登って見張りをする所、といわれている意味があるそうです。,0
はい。,1
えーいんかし、あ、すいません。,0
いん、インカルシベとも呼ばれ、アイヌの聖地とされていたっていう事で、ちょっとこうアイヌの人達の神様の棲んでるような、山みたいな感じなんですね。,0
こちらー、じゃああのー、チェックさせていただきますね。,0
はい。,1
ロープウェイとか、好きですか？,0
はい。,1
あ、良かったです。,0
すごく今写真で見てるんですけれども、あの夜の夜景が、札幌の街の夜景がすごい綺麗なので、是非、あの見て来ていただきたいと思います。,0
えーっと、こちらあのーロープウェイの、えー料金なんですけれども。,0
山頂まででは、大人が1800円で、子供は900円となっております。,0
よろしくお願いします。,0
あと、あの整備の点検とかで運休とか、悪天候の場合は、あのー運休する事がありますので、ご注意下さい。,0
ではこちら、チェック入れときますね。,0
はい。,1
では、えーとこの辺で、ご案内を終わらせていただきたいんですけれども、よろしいでしょうか？,0
はい。,1
はい。,0
では本日は、あの、ありがとうございました。,0
はい。,1
失礼致します。,0
失礼致します。,0
